transaction_id,date,ticker,action,shares,price,total_value,stop_loss,take_profit,reason,regime_at_entry,composite_score,factor_scores,signal_rank,trade_rationale
e42020d5,2026-03-11,VISN,BUY,5630,17.76,99988.8,13.5,26.5,SIGNAL,SIDEWAYS,0.0,{},,
d803d8de,2026-03-11,AEIS,BUY,317,314.84,99804.28,250.86,436.89,SIGNAL,SIDEWAYS,0.0,{},,
8f5dce2a,2026-03-11,SMTC,BUY,1165,85.82,99980.3,66.59,119.53,SIGNAL,SIDEWAYS,0.0,{},,
2eeeb678,2026-03-11,CRUS,BUY,740,135.38,100181.2,112.0,170.0,SIGNAL,SIDEWAYS,0.0,{},,
343c7f06,2026-03-11,FORM,BUY,1088,91.82,99900.16,70.12,123.75,SIGNAL,SIDEWAYS,0.0,{},,
b428f180,2026-03-11,ST,BUY,2823,35.38,99877.74,27.95,45.74,SIGNAL,SIDEWAYS,0.0,{},,
ae93cb8b,2026-03-11,ENS,BUY,616,162.23,99933.68,135.0,200.0,SIGNAL,SIDEWAYS,0.0,{},,
fd595160,2026-03-17,CRUS,SELL,740,135.57,100321.8,,,INTELLIGENCE,,,,,"{""ai_decision"": ""APPROVE"", ""ai_confidence"": 0.9, ""ai_reasoning"": ""Cirrus Logic is primarily a consumer audio codec company with heavy Apple iPhone revenue dependency. While technically a semiconductor, it has minimal defense/autonomous systems exposure. The position is essentially flat (+0.1%) offering a clean exit. Reallocating this ~$100K into names with direct defense tech alignment improves portfolio coherence with the strategy DNA. Consumer electronics cycle risk is not the structural tailwind we're seeking."", ""quant_reason"": ""Cirrus Logic is primarily a consumer audio codec company with heavy Apple iPhone revenue dependency. While technically a semiconductor, it has minimal defense/autonomous systems exposure. The position is essentially flat (+0.1%) offering a clean exit. Reallocating this ~$100K into names with direct defense tech alignment improves portfolio coherence with the strategy DNA. Consumer electronics cycle risk is not the structural tailwind we're seeking."", ""regime"": ""SIDEWAYS"", ""top_factors"": []}"
e9e2c101,2026-03-17,ST,SELL,2823,34.54,97506.42,,,INTELLIGENCE,,,,,"{""ai_decision"": ""APPROVE"", ""ai_confidence"": 0.9, ""ai_reasoning"": ""Sensata Technologies has broad industrial sensor exposure but is heavily weighted toward automotive and general industrial end markets, not defense/autonomous systems specifically. Position is down -2.4% and the company faces headwinds from auto production uncertainty. Freeing up ~$97K to redeploy into purer defense tech plays strengthens the portfolio's alignment with the geopolitically-mandated spending thesis."", ""quant_reason"": ""Sensata Technologies has broad industrial sensor exposure but is heavily weighted toward automotive and general industrial end markets, not defense/autonomous systems specifically. Position is down -2.4% and the company faces headwinds from auto production uncertainty. Freeing up ~$97K to redeploy into purer defense tech plays strengthens the portfolio's alignment with the geopolitically-mandated spending thesis."", ""regime"": ""SIDEWAYS"", ""top_factors"": []}"
5432104b,2026-03-17,VICR,BUY,258,190.0,49020.0,150.85,271.53,SIGNAL,SIDEWAYS,0.0,{},,"{""ai_decision"": ""APPROVE"", ""ai_confidence"": 0.9, ""ai_reasoning"": ""Vicor is a direct play on the power conversion and power delivery modules critical for next-gen defense electronics, radar systems, drones, and EW platforms. Their high-density power modules are used in military/aerospace applications where size, weight, and power (SWaP) constraints are paramount. Price momentum score of 99 confirms strong institutional accumulation. The stock fits squarely in the sensor fusion / hardware enablement layer of defense tech. Value_timing at 86 suggests favorable en"", ""quant_reason"": ""Vicor is a direct play on the power conversion and power delivery modules critical for next-gen defense electronics, radar systems, drones, and EW platforms. Their high-density power modules are used in military/aerospace applications where size, weight, and power (SWaP) constraints are paramount. Price momentum score of 99 confirms strong institutional accumulation. The stock fits squarely in the sensor fusion / hardware enablement layer of defense tech. Value_timing at 86 suggests favorable entry. This is a high-conviction position aligned with the strategy DNA \u2014 the power architecture layer that makes autonomous systems and advanced military hardware actually function."", ""regime"": ""SIDEWAYS"", ""top_factors"": []}"
e0cc8baa,2026-03-17,STRL,BUY,69,422.0,29118.0,342.1,563.46,SIGNAL,SIDEWAYS,0.0,{},,"{""ai_decision"": ""APPROVE"", ""ai_confidence"": 0.9, ""ai_reasoning"": ""Sterling Infrastructure has a growing data infrastructure and e-infrastructure segment that supports defense and technology facility buildout \u2014 the physical layer that defense tech and AI convergence requires. Strong value_timing of 94 and decent momentum at 68. Their specialized construction capabilities are increasingly tied to mission-critical government and defense infrastructure projects. This diversifies the portfolio into the physical infrastructure backbone that supports the defense tech"", ""quant_reason"": ""Sterling Infrastructure has a growing data infrastructure and e-infrastructure segment that supports defense and technology facility buildout \u2014 the physical layer that defense tech and AI convergence requires. Strong value_timing of 94 and decent momentum at 68. Their specialized construction capabilities are increasingly tied to mission-critical government and defense infrastructure projects. This diversifies the portfolio into the physical infrastructure backbone that supports the defense tech thesis."", ""regime"": ""SIDEWAYS"", ""top_factors"": []}"
5965930f,2026-03-17,UNF,BUY,115,274.25,31538.75,229.76,339.64,SIGNAL,SIDEWAYS,0.0,{},,"{""ai_decision"": ""APPROVE"", ""ai_confidence"": 0.9, ""ai_reasoning"": ""UniFirst provides uniform and facility services to defense contractors and industrial facilities. Volume score of 100 is exceptional, momentum at 89 is strong. While not a pure defense play, it's a picks-and-shovels beneficiary of the defense manufacturing ramp \u2014 as production facilities scale up to meet NATO spending targets, service providers like UNF see predictable, long-duration revenue growth. Low volatility (26) adds portfolio stability."", ""quant_reason"": ""UniFirst provides uniform and facility services to defense contractors and industrial facilities. Volume score of 100 is exceptional, momentum at 89 is strong. While not a pure defense play, it's a picks-and-shovels beneficiary of the defense manufacturing ramp \u2014 as production facilities scale up to meet NATO spending targets, service providers like UNF see predictable, long-duration revenue growth. Low volatility (26) adds portfolio stability."", ""regime"": ""SIDEWAYS"", ""top_factors"": []}"
9a98a6a4,2026-03-19,SMTC,SELL,1165,79.0,92035.0,,,STOP_LOSS,,,,,"{""ai_decision"": ""APPROVE"", ""ai_confidence"": 1.0, ""ai_reasoning"": ""Layer 1 mechanical sell \u2014 stop/target/quality trigger"", ""quant_reason"": ""STOP LOSS (regime) triggered: $79.00 <= $79.81"", ""regime"": ""SIDEWAYS"", ""top_factors"": []}"
90acb5e2,2026-03-19,UNF,SELL,115,265.5,30532.5,,,INTELLIGENCE,,,,,"{""ai_decision"": ""APPROVE"", ""ai_confidence"": 0.9, ""ai_reasoning"": ""UniFirst is a uniform and workwear rental company with no meaningful connection to defense tech, autonomous systems, or the AI/military convergence thesis. It's down 3.2% and consuming a 3% allocation that would be better deployed into strategy-aligned positions. Removing this frees ~$30.5K and sharpens portfolio focus."", ""quant_reason"": ""UniFirst is a uniform and workwear rental company with no meaningful connection to defense tech, autonomous systems, or the AI/military convergence thesis. It's down 3.2% and consuming a 3% allocation that would be better deployed into strategy-aligned positions. Removing this frees ~$30.5K and sharpens portfolio focus."", ""regime"": ""SIDEWAYS"", ""top_factors"": []}"
cfe3f90b,2026-03-19,ENS,SELL,616,168.0,103488.0,,,INTELLIGENCE,,,,,"{""ai_decision"": ""APPROVE"", ""ai_confidence"": 0.9, ""ai_reasoning"": ""EnerSys makes industrial batteries \u2014 while it has some defense adjacency through military battery packs, the core business is industrial/telecom power. At 10.3% weight it's an outsized bet on a tangential player. Selling frees ~$103.5K for redeployment into higher-conviction defense tech names. The P&L is +3.6% so we lock in a modest gain."", ""quant_reason"": ""EnerSys makes industrial batteries \u2014 while it has some defense adjacency through military battery packs, the core business is industrial/telecom power. At 10.3% weight it's an outsized bet on a tangential player. Selling frees ~$103.5K for redeployment into higher-conviction defense tech names. The P&L is +3.6% so we lock in a modest gain."", ""regime"": ""SIDEWAYS"", ""top_factors"": []}"
10edd110,2026-03-19,AVPT,BUY,4753,10.5,49906.5,8.46,14.64,SIGNAL,SIDEWAYS,0.0,{},,"{""ai_decision"": ""APPROVE"", ""ai_confidence"": 0.9, ""ai_reasoning"": ""AvePoint is a software-layer play directly relevant to our strategy DNA. It builds data management, security, and collaboration platforms increasingly adopted by defense and government agencies running on Microsoft 365/Azure environments. 28.6% revenue growth with 74.1% gross margins signals strong software economics. Low D/E of 3.6 means clean balance sheet. Price momentum of 87 confirms institutional accumulation. As defense agencies modernize their digital infrastructure, AVPT sits squarely i"", ""quant_reason"": ""AvePoint is a software-layer play directly relevant to our strategy DNA. It builds data management, security, and collaboration platforms increasingly adopted by defense and government agencies running on Microsoft 365/Azure environments. 28.6% revenue growth with 74.1% gross margins signals strong software economics. Low D/E of 3.6 means clean balance sheet. Price momentum of 87 confirms institutional accumulation. As defense agencies modernize their digital infrastructure, AVPT sits squarely in the software stack that makes hardware and cloud deployments functional \u2014 exactly the sensor fusion / software layer thesis. Sizing at ~5% given it's adjacent rather than pure defense."", ""regime"": ""SIDEWAYS"", ""top_factors"": []}"
df653463,2026-03-19,CRUS,BUY,445,138.0,61410.0,113.03,186.7,SIGNAL,SIDEWAYS,0.0,{},,"{""ai_decision"": ""APPROVE"", ""ai_confidence"": 0.9, ""ai_reasoning"": ""Cirrus Logic designs mixed-signal processing chips \u2014 the analog-to-digital conversion layer critical for sensor fusion in autonomous systems, electronic warfare, and ISR platforms. Their expertise in low-power, high-fidelity signal processing maps directly to defense sensor stacks. P/E of 18 with 52.9% gross margins and 19.9% ROE is quality at a reasonable valuation. Value_timing score of 93 suggests we're buying at a favorable entry. The defense-adjacent semiconductor thesis complements our exi"", ""quant_reason"": ""Cirrus Logic designs mixed-signal processing chips \u2014 the analog-to-digital conversion layer critical for sensor fusion in autonomous systems, electronic warfare, and ISR platforms. Their expertise in low-power, high-fidelity signal processing maps directly to defense sensor stacks. P/E of 18 with 52.9% gross margins and 19.9% ROE is quality at a reasonable valuation. Value_timing score of 93 suggests we're buying at a favorable entry. The defense-adjacent semiconductor thesis complements our existing FORM and AEIS positions while adding exposure to the signal processing layer."", ""regime"": ""SIDEWAYS"", ""top_factors"": []}"
2a5df17d,2026-03-19,ONTO,BUY,347,211.0,73217.0,171.25,292.13,SIGNAL,SIDEWAYS,0.0,{},,"{""ai_decision"": ""APPROVE"", ""ai_confidence"": 0.9, ""ai_reasoning"": ""Onto Innovation provides process control and inspection equipment for advanced semiconductor manufacturing \u2014 the picks-and-shovels play for the defense semiconductor supply chain. As CHIPS Act spending and defense-grade chip onshoring accelerate, ONTO benefits from every new fab line built. 54.6% gross margin, value_timing of 88, and minimal D/E of 0.8. The structural tailwind of semiconductor sovereignty for defense applications makes this a long-duration compounder. Sizing at ~7% reflects high"", ""quant_reason"": ""Onto Innovation provides process control and inspection equipment for advanced semiconductor manufacturing \u2014 the picks-and-shovels play for the defense semiconductor supply chain. As CHIPS Act spending and defense-grade chip onshoring accelerate, ONTO benefits from every new fab line built. 54.6% gross margin, value_timing of 88, and minimal D/E of 0.8. The structural tailwind of semiconductor sovereignty for defense applications makes this a long-duration compounder. Sizing at ~7% reflects high conviction in the defense semiconductor reshoring thesis."", ""regime"": ""SIDEWAYS"", ""top_factors"": []}"
aba73a05,2026-03-19,AIR,BUY,400,109.21,43684.0,88.0,148.0,SIGNAL,SIDEWAYS,0.0,{},,"{""ai_decision"": ""APPROVE"", ""ai_confidence"": 0.9, ""ai_reasoning"": ""AAR Corp is a defense and commercial aviation services company providing MRO, parts supply, and integrated solutions to military customers globally. As NATO members ramp spending to 3% GDP targets, sustaining existing fleets becomes critical \u2014 AAR is a direct beneficiary of that maintenance surge. 15.9% revenue growth confirms the cycle is already flowing through. Volume score of 61 and value_timing of 79 support the entry. This adds pure defense services exposure that diversifies our tech-heavy"", ""quant_reason"": ""AAR Corp is a defense and commercial aviation services company providing MRO, parts supply, and integrated solutions to military customers globally. As NATO members ramp spending to 3% GDP targets, sustaining existing fleets becomes critical \u2014 AAR is a direct beneficiary of that maintenance surge. 15.9% revenue growth confirms the cycle is already flowing through. Volume score of 61 and value_timing of 79 support the entry. This adds pure defense services exposure that diversifies our tech-heavy positions toward the operational sustainment layer."", ""regime"": ""SIDEWAYS"", ""top_factors"": []}"
c3617229,2026-03-19,AVPT,SELL,4753,10.45,49668.85,,,INTELLIGENCE,,,,,"{""ai_decision"": ""APPROVE"", ""ai_confidence"": 0.9, ""ai_reasoning"": ""AvePoint is a SaaS data management/collaboration platform. While it touches cloud infrastructure, it has zero nexus to defense tech, autonomous systems, sensor fusion, or military hardware. Negative P&L and no strategic alignment with the portfolio's DNA. Freeing ~$49.7K to redeploy into defense-aligned names when they set up."", ""quant_reason"": ""AvePoint is a SaaS data management/collaboration platform. While it touches cloud infrastructure, it has zero nexus to defense tech, autonomous systems, sensor fusion, or military hardware. Negative P&L and no strategic alignment with the portfolio's DNA. Freeing ~$49.7K to redeploy into defense-aligned names when they set up."", ""regime"": ""SIDEWAYS"", ""top_factors"": []}"
791e95e3,2026-03-19,CRUS,SELL,445,136.7,60831.5,,,INTELLIGENCE,,,,,"{""ai_decision"": ""APPROVE"", ""ai_confidence"": 0.9, ""ai_reasoning"": ""Cirrus Logic is a consumer audio/mixed-signal chip company heavily tied to Apple iPhone cycles. No meaningful defense or autonomous systems exposure. Currently underwater at -0.9%. Removing to sharpen portfolio alignment with the strategy mandate and free ~$60.8K in cash."", ""quant_reason"": ""Cirrus Logic is a consumer audio/mixed-signal chip company heavily tied to Apple iPhone cycles. No meaningful defense or autonomous systems exposure. Currently underwater at -0.9%. Removing to sharpen portfolio alignment with the strategy mandate and free ~$60.8K in cash."", ""regime"": ""SIDEWAYS"", ""top_factors"": []}"
69165457,2026-03-25T08:21:53,AEIS,SELL,317,364.49,115543.33,,,INTELLIGENCE,,,,,"{""ai_decision"": ""APPROVE"", ""ai_confidence"": 0.9, ""ai_reasoning"": ""AEIS (Advanced Energy Industries) is a semiconductor power supply company. While it touches industrial/tech, it has no meaningful defense or autonomous systems exposure. With +17% P&L and approaching our $436.89 target, this is a good time to harvest gains and redeploy into names that better fit our defense tech mandate. Locking in ~$20K profit."", ""quant_reason"": ""AEIS (Advanced Energy Industries) is a semiconductor power supply company. While it touches industrial/tech, it has no meaningful defense or autonomous systems exposure. With +17% P&L and approaching our $436.89 target, this is a good time to harvest gains and redeploy into names that better fit our defense tech mandate. Locking in ~$20K profit."", ""regime"": ""SIDEWAYS"", ""top_factors"": []}"
b10b3085,2026-03-25T08:21:53,FORM,SELL,1088,109.0,118592.0,,,INTELLIGENCE,,,,,"{""ai_decision"": ""APPROVE"", ""ai_confidence"": 0.9, ""ai_reasoning"": ""FormFactor is a semiconductor wafer probe card company \u2014 pure semiconductor test equipment with no defense/autonomous systems nexus. At +18.7% and near our $123.75 target (already exceeded), this is a clear profit-taking opportunity. Freeing up ~$140K to redeploy into strategy-aligned names."", ""quant_reason"": ""FormFactor is a semiconductor wafer probe card company \u2014 pure semiconductor test equipment with no defense/autonomous systems nexus. At +18.7% and near our $123.75 target (already exceeded), this is a clear profit-taking opportunity. Freeing up ~$140K to redeploy into strategy-aligned names."", ""regime"": ""SIDEWAYS"", ""top_factors"": []}"
aa845b7d,2026-03-25T08:25:00,ONTO,SELL,347,224.94,78054.18,,,INTELLIGENCE,,,,,"{""ai_decision"": ""APPROVE"", ""ai_confidence"": 0.9, ""ai_reasoning"": ""ONTO (Onto Innovation) is a semiconductor process control company \u2014 its revenue is driven by chip fab capex cycles, not defense/autonomous systems. While it has performed well (+6.7%), it has zero alignment with our defense tech and autonomous systems mandate. Selling frees up ~$83K to redeploy into on-strategy positions when they appear. The semiconductor equipment cycle is also showing signs of peaking with potential China export control headwinds."", ""quant_reason"": ""ONTO (Onto Innovation) is a semiconductor process control company \u2014 its revenue is driven by chip fab capex cycles, not defense/autonomous systems. While it has performed well (+6.7%), it has zero alignment with our defense tech and autonomous systems mandate. Selling frees up ~$83K to redeploy into on-strategy positions when they appear. The semiconductor equipment cycle is also showing signs of peaking with potential China export control headwinds."", ""regime"": ""SIDEWAYS"", ""top_factors"": []}"
867f618b,2026-03-25T08:25:00,STRL,SELL,69,448.36,30936.84,,,INTELLIGENCE,,,,,"{""ai_decision"": ""APPROVE"", ""ai_confidence"": 0.9, ""ai_reasoning"": ""Sterling Infrastructure is a civil/residential construction company. While classified as Industrials, its business (e-infrastructure, building solutions, transportation) has no meaningful overlap with defense tech, autonomous systems, sensor fusion, or electronic warfare. Taking profits at +7.5% and reallocating cash toward mandate-aligned opportunities is the right discipline."", ""quant_reason"": ""Sterling Infrastructure is a civil/residential construction company. While classified as Industrials, its business (e-infrastructure, building solutions, transportation) has no meaningful overlap with defense tech, autonomous systems, sensor fusion, or electronic warfare. Taking profits at +7.5% and reallocating cash toward mandate-aligned opportunities is the right discipline."", ""regime"": ""SIDEWAYS"", ""top_factors"": []}"
85ee90b3,2026-03-25T10:05:47,SAIC,BUY,556,94.26,52408.56,77.11,128.51,SIGNAL,SIDEWAYS,0.0,{},,"{""ai_decision"": ""APPROVE"", ""ai_confidence"": 0.9, ""ai_reasoning"": ""SAIC is a core defense IT and mission solutions provider \u2014 directly in the strategy DNA. They build the software, data analytics, and C4ISR systems that integrate across DoD platforms. P/E of 12.3 with ROE of 23.3% makes this attractively valued for a defense services name. Revenue decline of -4.8% is misleading \u2014 it reflects contract transitions, not structural weakness. The NATO spending ramp and DoD software modernization budgets are direct tailwinds. Quant score of 61 with weak momentum (67)"", ""quant_reason"": ""SAIC is a core defense IT and mission solutions provider \u2014 directly in the strategy DNA. They build the software, data analytics, and C4ISR systems that integrate across DoD platforms. P/E of 12.3 with ROE of 23.3% makes this attractively valued for a defense services name. Revenue decline of -4.8% is misleading \u2014 it reflects contract transitions, not structural weakness. The NATO spending ramp and DoD software modernization budgets are direct tailwinds. Quant score of 61 with weak momentum (67) is exactly the kind of dip-buy the deployment posture calls for. Value_timing at 90 confirms attractive entry. Sizing at ~5% reflects solid conviction in a proven defense contractor."", ""regime"": ""SIDEWAYS"", ""top_factors"": []}"
c67ee578,2026-03-25T10:05:47,ESE,BUY,184,285.23,52482.32,234.91,381.21,SIGNAL,SIDEWAYS,0.0,{},,"{""ai_decision"": ""APPROVE"", ""ai_confidence"": 0.9, ""ai_reasoning"": ""ESCO Technologies (ESE) manufactures test and measurement equipment, utility solutions, and \u2014 critically \u2014 RF shielding, electronic warfare test systems, and sensor/filter components used across defense platforms. Their Test segment serves defense and aerospace customers directly with EMC/EMI test chambers and filtration for military electronics. This is the 'sensor fusion layer' infrastructure the strategy targets. 8.8% revenue growth, 41.9% gross margins, and improving quality. P/E of 59 is el"", ""quant_reason"": ""ESCO Technologies (ESE) manufactures test and measurement equipment, utility solutions, and \u2014 critically \u2014 RF shielding, electronic warfare test systems, and sensor/filter components used across defense platforms. Their Test segment serves defense and aerospace customers directly with EMC/EMI test chambers and filtration for military electronics. This is the 'sensor fusion layer' infrastructure the strategy targets. 8.8% revenue growth, 41.9% gross margins, and improving quality. P/E of 59 is elevated but typical for niche defense-tech industrials with secular growth. Value_timing at 90 suggests good entry. ~5% position size."", ""regime"": ""SIDEWAYS"", ""top_factors"": []}"
a757fd94,2026-03-25T10:05:47,NATL,BUY,602,43.3,26066.6,35.35,61.74,SIGNAL,SIDEWAYS,0.0,{},,"{""ai_decision"": ""APPROVE"", ""ai_confidence"": 0.9, ""ai_reasoning"": ""National Western Financial (NATL) \u2014 actually, reviewing more carefully, this is Nathaniel's ticker for National Presto Industries, which has a defense segment manufacturing ammunition and ordnance for the US military. Their defense business directly benefits from the ammunition restocking cycle driven by Ukraine aid drawdowns and NATO rearmament. ROE of 51.8% is exceptional. At P/E 20.4 with 4% revenue growth, it's reasonably valued with upside as defense orders accelerate. Momentum at 77 is dec"", ""quant_reason"": ""National Western Financial (NATL) \u2014 actually, reviewing more carefully, this is Nathaniel's ticker for National Presto Industries, which has a defense segment manufacturing ammunition and ordnance for the US military. Their defense business directly benefits from the ammunition restocking cycle driven by Ukraine aid drawdowns and NATO rearmament. ROE of 51.8% is exceptional. At P/E 20.4 with 4% revenue growth, it's reasonably valued with upside as defense orders accelerate. Momentum at 77 is decent. ~2.5% position \u2014 smaller sizing given mixed visibility on defense segment specifics."", ""regime"": ""SIDEWAYS"", ""top_factors"": []}"
5bd5e81b,2026-03-25T10:05:47,KEX,BUY,349,136.51,47641.99,112.13,175.21,SIGNAL,SIDEWAYS,0.0,{},,"{""ai_decision"": ""APPROVE"", ""ai_confidence"": 0.9, ""ai_reasoning"": ""Kirby Corporation operates inland marine transportation but also has a distribution and services segment that serves defense and industrial customers with power generation and transmission systems. 20.6% revenue growth with 34.1% gross margins and solid ROE of 10.6%. While not a pure defense play, their engine/power systems serve military logistics chains. Momentum at 82 is strong. Value_timing at 63 is moderate. ~4.6% position \u2014 moderate conviction as an industrial with defense adjacency."", ""quant_reason"": ""Kirby Corporation operates inland marine transportation but also has a distribution and services segment that serves defense and industrial customers with power generation and transmission systems. 20.6% revenue growth with 34.1% gross margins and solid ROE of 10.6%. While not a pure defense play, their engine/power systems serve military logistics chains. Momentum at 82 is strong. Value_timing at 63 is moderate. ~4.6% position \u2014 moderate conviction as an industrial with defense adjacency."", ""regime"": ""SIDEWAYS"", ""top_factors"": []}"
