transaction_id,date,ticker,action,shares,price,total_value,stop_loss,take_profit,reason,regime_at_entry,composite_score,factor_scores,signal_rank,trade_rationale
023e6737,2026-04-01T17:20:25,DRS,BUY,3262,44.98,146718.89,36.78,60.81,SIGNAL,SIDEWAYS,0.0,{},,"{""ai_decision"": ""APPROVE"", ""ai_confidence"": 0.9, ""ai_reasoning"": ""Leonardo DRS is a pure-play defense electronics company specializing in advanced sensing, network computing, and electronic warfare \u2014 directly in the sensor fusion / software stack sweet spot of the strategy DNA. 8.1% revenue growth, low D/E of 17.2, and ROE of 10.5%. P/E of 44.5 is elevated but justified by long-duration DoD contracts and structural NATO spending tailwinds. Value_timing score of 93 and volume score of 61 suggest institutional accumulation at these levels. The weak price_momentu"", ""quant_reason"": ""AI allocation"", ""regime"": ""SIDEWAYS"", ""top_factors"": []}"
ceb64f1b,2026-04-01T17:20:25,ESE,BUY,334,298.15,99582.1,252.23,391.57,SIGNAL,SIDEWAYS,0.0,{},,"{""ai_decision"": ""APPROVE"", ""ai_confidence"": 0.9, ""ai_reasoning"": ""ESCO Technologies operates across utility solutions, aerospace, and defense test & measurement \u2014 their filtration and RF shielding products serve defense/aerospace platforms directly. Strong price momentum of 79, solid volume at 78, and 8.8% revenue growth. Recently stopped out but conditions haven't changed \u2014 the structural demand for test infrastructure supporting next-gen defense platforms remains intact. Sizing to ~10% of equity as a complementary defense-adjacent technology play."", ""quant_reason"": ""AI allocation"", ""regime"": ""SIDEWAYS"", ""top_factors"": []}"
d6519213,2026-04-01T17:20:25,CW,BUY,99,710.92,70381.08,600.93,929.18,SIGNAL,SIDEWAYS,0.0,{},,"{""ai_decision"": ""APPROVE"", ""ai_confidence"": 0.9, ""ai_reasoning"": ""Curtiss-Wright is a defense-industrial company providing engineered products for naval defense, nuclear propulsion, and aerospace platforms. 14.9% revenue growth, strong ROE of 19.4%, and value_timing of 87. Price momentum of 75 is healthy. Their sensor and actuation systems for submarines, aircraft carriers, and fighter jets place them squarely in the hardware-that-needs-software-to-work layer. P/E of 54.2 is rich but reflects the premium the market assigns to predictable, long-cycle defense re"", ""quant_reason"": ""AI allocation"", ""regime"": ""SIDEWAYS"", ""top_factors"": []}"
e8748f60,2026-04-01T17:20:25,ATI,BUY,354,153.0,54162.0,128.43,197.59,SIGNAL,SIDEWAYS,0.0,{},,"{""ai_decision"": ""APPROVE"", ""ai_confidence"": 0.9, ""ai_reasoning"": ""ATI Inc. (formerly Allegheny Technologies) produces specialty alloys and advanced materials critical for jet engines, airframes, and defense applications. Their titanium and nickel alloys are essential inputs for F-35, next-gen drone platforms, and hypersonic systems. Revenue growth modest at 0.4% but ROE of 21.6% shows operational excellence. Price momentum of 71 and value_timing of 84 are supportive. The defense supply chain for advanced materials is structurally tight. Sizing to ~5.4% of equi"", ""quant_reason"": ""AI allocation"", ""regime"": ""SIDEWAYS"", ""top_factors"": []}"
98d5714f,2026-04-02T09:39:05,BWXT,BUY,230,208.3,47909.0,178.0,280.0,SIGNAL,SIDEWAYS,0.0,{},,"{""ai_decision"": ""APPROVE"", ""ai_confidence"": 0.9, ""ai_reasoning"": ""Core defense-tech pure-play: BWX Technologies is a nuclear technology provider for naval defense (submarine/carrier reactors) and advanced nuclear systems. 18.7% revenue growth, strong ROE of 28.5%, and highest quant score among on-mandate names at 60. Value_timing at 89 suggests good entry. Long-duration government contracts with predictable revenue streams. Recent reentry opportunity after selling 3 days ago \u2014 the structural thesis is unchanged and NATO nuclear modernization programs provide m"", ""quant_reason"": ""AI allocation"", ""regime"": ""SIDEWAYS"", ""top_factors"": []}"
fc81bc7c,2026-04-02T09:39:05,NOC,BUY,64,704.0,45056.0,622.68,883.8,SIGNAL,SIDEWAYS,0.0,{},,"{""ai_decision"": ""APPROVE"", ""ai_confidence"": 0.9, ""ai_reasoning"": ""Northrop Grumman is a top-tier defense prime with exposure to exactly the right segments: space-based ISR (satellites, ground systems), autonomous systems (B-21 bomber, MQ-4C Triton), and advanced electronics/cyber. 9.6% revenue growth, solid P/E of 24.1 for a defense prime, and ROE of 26.2%. Value_timing score of 91 is excellent \u2014 the price_momentum of 50 reflects the sideways action that our mandate says to buy through. Weak momentum in a structurally mandated spending environment = better ent"", ""quant_reason"": ""AI allocation"", ""regime"": ""SIDEWAYS"", ""top_factors"": []}"
11b18fa3,2026-04-02T09:39:05,PL,BUY,751,31.58,23716.5,24.44,47.88,SIGNAL,SIDEWAYS,0.0,{},,"{""ai_decision"": ""APPROVE"", ""ai_confidence"": 0.9, ""ai_reasoning"": ""Planet Labs is a high-conviction thesis name: space-based ISR with the largest constellation of Earth-observation satellites. Price_momentum of 98 is the highest on the watchlist. 41.1% revenue growth reflects accelerating defense/intelligence community adoption. Negative ROE and no P/E are typical for growth-stage space companies but the revenue trajectory and contract pipeline are what matter. This is exactly the 'sensor fusion layer' and data infrastructure our mandate targets. The asymmetry "", ""quant_reason"": ""AI allocation"", ""regime"": ""SIDEWAYS"", ""top_factors"": []}"
8973eef7,2026-04-02T09:39:05,BAH,BUY,250,80.51,20127.5,68.0,110.0,SIGNAL,SIDEWAYS,0.0,{},,"{""ai_decision"": ""APPROVE"", ""ai_confidence"": 0.9, ""ai_reasoning"": ""Booz Allen Hamilton is the premier defense IT and AI services contractor \u2014 they build the software stacks, analytics platforms, and AI/ML systems that make DoD hardware work. This is the exact 'software layer' our strategy DNA targets. P/E of 12.0 is extremely cheap for a defense-tech name, ROE of 75.1% is outstanding. Value_timing at 90 and weak momentum of 43 aligns with our mandate to buy dips in structurally sound defense names. Revenue decline of -10.2% likely reflects contract timing, not "", ""quant_reason"": ""AI allocation"", ""regime"": ""SIDEWAYS"", ""top_factors"": []}"
16a59d8c,2026-04-02T09:39:05,RDW,BUY,1503,9.03,13572.09,6.78,14.47,SIGNAL,SIDEWAYS,0.0,{},,"{""ai_decision"": ""APPROVE"", ""ai_confidence"": 0.9, ""ai_reasoning"": ""Redwire is a pure-play space infrastructure company building sensors, antennas, and autonomous systems for defense and national security space missions. 56.4% revenue growth is exceptional. Value_timing of 92 suggests a strong entry point. Negative ROE and no P/E are expected for a scaling space company. This is a high-conviction asymmetric bet on the space-based ISR buildout that NATO and US Space Force are accelerating. Small position at ~$13.6K (~1.4% of equity) reflects the speculative natur"", ""quant_reason"": ""AI allocation"", ""regime"": ""SIDEWAYS"", ""top_factors"": []}"
30650c17,2026-04-06T13:19:22,RCAT,BUY,200,12.84,2568.0,9.0,19.5,SIGNAL,SIDEWAYS,0.0,"{""price_momentum"": 42.3, ""earnings_growth"": 50.0, ""quality"": 50.0, ""value_timing"": 47.9, ""volume"": 35.9, ""volatility"": 0}",,"{""ai_decision"": ""APPROVE"", ""ai_confidence"": 0.9, ""ai_reasoning"": ""Red Cat Holdings is a pure-play drone/autonomous systems company directly aligned with our strategy DNA. Despite a low quant score of 39, this is a thesis-driven buy \u2014 RCAT is building the software and hardware stack for small UAS platforms that are seeing accelerated procurement across DoD and NATO allies. The low score reflects weak momentum and early-stage financials (negative earnings, thin margins), but the contract pipeline and structural tailwinds from drone warfare adoption are the real "", ""quant_reason"": ""AI allocation"", ""regime"": ""SIDEWAYS"", ""top_factors"": [{""name"": ""earnings_growth"", ""score"": 50.0}, {""name"": ""quality"", ""score"": 50.0}, {""name"": ""value_timing"", ""score"": 47.9}]}"
bbc7b8ad,2026-04-06T13:19:22,RTX,BUY,50,197.92,9896.0,172.0,255.0,SIGNAL,SIDEWAYS,0.0,"{""price_momentum"": 46.6, ""earnings_growth"": 50.0, ""quality"": 50.0, ""value_timing"": 93.8, ""volume"": 40.2, ""volatility"": 66.9}",,"{""ai_decision"": ""APPROVE"", ""ai_confidence"": 0.9, ""ai_reasoning"": ""RTX is a core defense prime with strong relevance to our mandate \u2014 they own the sensor, electronic warfare, and missile defense layers across NATO programs. Score of 60 with excellent value_timing at 94 and decent momentum at 47 in a sideways regime suggests a good entry. Rev growth +12.1% with long-duration defense contracts. We already hold LMT, GD, NOC but RTX fills the gap as the most EW/sensor-focused prime. At ~$9,896 this uses most of remaining cash but fits the structural thesis perfectl"", ""quant_reason"": ""AI allocation"", ""regime"": ""SIDEWAYS"", ""top_factors"": [{""name"": ""value_timing"", ""score"": 93.8}, {""name"": ""volatility"", ""score"": 66.9}, {""name"": ""earnings_growth"", ""score"": 50.0}]}"
