transaction_id,date,ticker,action,shares,price,total_value,stop_loss,take_profit,reason,regime_at_entry,composite_score,factor_scores,signal_rank,trade_rationale
9ff814aa,2026-03-25T10:05:47,UNF,BUY,100,263.54,26354.0,218.0,340.0,SIGNAL,SIDEWAYS,0.0,{},,"{""ai_decision"": ""APPROVE"", ""ai_confidence"": 0.9, ""ai_reasoning"": ""UniFirst provides managed uniform and facility services, including to defense contractors and military installations. While not a direct defense-tech play, it's a predictable-revenue industrial with 88 value_timing and 88 momentum. Low D/E of 3.6 and 36.5% gross margins offer defensive quality. This adds portfolio diversification with an industrial that benefits from expanding defense facility footprints. ~2.5% position \u2014 smaller sizing as a supporting rather than core thesis name."", ""quant_reason"": ""UniFirst provides managed uniform and facility services, including to defense contractors and military installations. While not a direct defense-tech play, it's a predictable-revenue industrial with 88 value_timing and 88 momentum. Low D/E of 3.6 and 36.5% gross margins offer defensive quality. This adds portfolio diversification with an industrial that benefits from expanding defense facility footprints. ~2.5% position \u2014 smaller sizing as a supporting rather than core thesis name."", ""regime"": ""SIDEWAYS"", ""top_factors"": []}"
4ce5e1c5,2026-03-25T10:27:53,KEX,SELL,349,136.62,47680.38,,,INTELLIGENCE,,,,,"{""ai_decision"": ""APPROVE"", ""ai_confidence"": 0.9, ""ai_reasoning"": ""Kirby Corporation is an inland tank barge operator \u2014 while classified as Industrials, it has zero defense/autonomous systems exposure. This is a pure marine transportation/energy logistics play. Selling frees ~$47.7K of capital to redeploy into defense-aligned names. The position is essentially flat (+0.1%) so there's minimal opportunity cost."", ""quant_reason"": ""Kirby Corporation is an inland tank barge operator \u2014 while classified as Industrials, it has zero defense/autonomous systems exposure. This is a pure marine transportation/energy logistics play. Selling frees ~$47.7K of capital to redeploy into defense-aligned names. The position is essentially flat (+0.1%) so there's minimal opportunity cost."", ""regime"": ""SIDEWAYS"", ""top_factors"": []}"
0cb76e7b,2026-03-25T10:27:53,UNF,SELL,100,260.72,26072.0,,,INTELLIGENCE,,,,,"{""ai_decision"": ""APPROVE"", ""ai_confidence"": 0.9, ""ai_reasoning"": ""UniFirst is a uniform/workwear rental company with no defense technology relevance. It's down 1.1% and has no connection to our thesis of AI, autonomous systems, sensor fusion, or defense software stacks. Selling reclaims ~$25.8K for redeployment into core thesis names."", ""quant_reason"": ""UniFirst is a uniform/workwear rental company with no defense technology relevance. It's down 1.1% and has no connection to our thesis of AI, autonomous systems, sensor fusion, or defense software stacks. Selling reclaims ~$25.8K for redeployment into core thesis names."", ""regime"": ""SIDEWAYS"", ""top_factors"": []}"
1eb0dc5d,2026-03-25T10:27:53,LHX,BUY,284,352.03,99976.55,295.51,440.76,SIGNAL,SIDEWAYS,0.0,{},,"{""ai_decision"": ""APPROVE"", ""ai_confidence"": 0.9, ""ai_reasoning"": ""L3Harris is a core defense prime with heavy exposure to exactly our thesis \u2014 space-based ISR, electronic warfare, sensor fusion, and C5ISR software stacks. They are a primary beneficiary of NATO spending acceleration and US DoD modernization. The stock has modest momentum (69) but excellent value_timing (71) and low volatility (60). P/E of 41x is elevated but reflects the long-duration contract backlog. At ~$351 this is a reasonable entry for a name that should compound as European defense budge"", ""quant_reason"": ""L3Harris is a core defense prime with heavy exposure to exactly our thesis \u2014 space-based ISR, electronic warfare, sensor fusion, and C5ISR software stacks. They are a primary beneficiary of NATO spending acceleration and US DoD modernization. The stock has modest momentum (69) but excellent value_timing (71) and low volatility (60). P/E of 41x is elevated but reflects the long-duration contract backlog. At ~$351 this is a reasonable entry for a name that should compound as European defense budgets flow through. Sizing at ~9.6% reflects high conviction in a tier-1 defense name."", ""regime"": ""SIDEWAYS"", ""top_factors"": []}"
9419201d,2026-03-25T10:27:53,SAIC,BUY,302,94.94,28671.88,76.58,127.62,SIGNAL,SIDEWAYS,0.0,{},,"{""ai_decision"": ""APPROVE"", ""ai_confidence"": 0.9, ""ai_reasoning"": ""Adding to existing SAIC position. SAIC is a pure-play defense IT and software integrator \u2014 exactly the 'software stack' layer our thesis targets. They do sensor fusion, C4ISR modernization, digital engineering, and AI/ML for DoD. Current position is only 5.1% weight and stock is essentially flat since entry. Adding 300 shares brings total to 856 shares (~7.8% weight), still well within limits. The structural contract pipeline is intact and the stock is consolidating at a good entry level."", ""quant_reason"": ""Adding to existing SAIC position. SAIC is a pure-play defense IT and software integrator \u2014 exactly the 'software stack' layer our thesis targets. They do sensor fusion, C4ISR modernization, digital engineering, and AI/ML for DoD. Current position is only 5.1% weight and stock is essentially flat since entry. Adding 300 shares brings total to 856 shares (~7.8% weight), still well within limits. The structural contract pipeline is intact and the stock is consolidating at a good entry level."", ""regime"": ""SIDEWAYS"", ""top_factors"": []}"
0243e4f9,2026-03-25T10:27:53,ESE,BUY,120,286.51,34381.8,233.7,379.24,SIGNAL,SIDEWAYS,0.0,{},,"{""ai_decision"": ""APPROVE"", ""ai_confidence"": 0.9, ""ai_reasoning"": ""Adding to ESCO Technologies position. ESE makes test & measurement equipment, RF shielding, and utility solutions with meaningful defense/aerospace sensor and electronic warfare exposure. Their filtration and test business serves defense platforms directly. Current weight is 5.1% \u2014 adding 120 shares brings us to ~8.4% weight, reflecting strong conviction in their niche defense electronics exposure. Value_timing at 92 suggests favorable entry."", ""quant_reason"": ""Adding to ESCO Technologies position. ESE makes test & measurement equipment, RF shielding, and utility solutions with meaningful defense/aerospace sensor and electronic warfare exposure. Their filtration and test business serves defense platforms directly. Current weight is 5.1% \u2014 adding 120 shares brings us to ~8.4% weight, reflecting strong conviction in their niche defense electronics exposure. Value_timing at 92 suggests favorable entry."", ""regime"": ""SIDEWAYS"", ""top_factors"": []}"
9d5dd8b5,2026-03-25T10:27:53,NATL,BUY,600,43.31,25986.0,35.35,61.74,SIGNAL,SIDEWAYS,0.0,{},,"{""ai_decision"": ""APPROVE"", ""ai_confidence"": 0.9, ""ai_reasoning"": ""Doubling down on National Presto / NCR Atleos (NATL). Current position is only 2.5% weight which is undersized for a conviction name. Adding 600 shares brings total to 1202 shares (~5.0% weight). This is a small-cap defense adjacent name and at current levels represents a better entry point for building the position to a meaningful weight."", ""quant_reason"": ""Doubling down on National Presto / NCR Atleos (NATL). Current position is only 2.5% weight which is undersized for a conviction name. Adding 600 shares brings total to 1202 shares (~5.0% weight). This is a small-cap defense adjacent name and at current levels represents a better entry point for building the position to a meaningful weight."", ""regime"": ""SIDEWAYS"", ""top_factors"": []}"
cc4b6946,2026-03-25T10:27:53,VISN,BUY,1583,18.79,29744.57,12.79,25.1,SIGNAL,SIDEWAYS,0.0,{},,"{""ai_decision"": ""APPROVE"", ""ai_confidence"": 0.9, ""ai_reasoning"": ""Adding to our largest conviction position in Telos Corp (VISN). This is a pure-play cybersecurity and identity management company serving DoD and intelligence community. Their Xacta platform and identity verification solutions are mission-critical for defense IT modernization. Stock is up 5.7% and trending well. Adding 1500 shares brings total to 7130 shares (~13.5% weight). This is our highest conviction mid-cap pure-play on defense software infrastructure."", ""quant_reason"": ""Adding to our largest conviction position in Telos Corp (VISN). This is a pure-play cybersecurity and identity management company serving DoD and intelligence community. Their Xacta platform and identity verification solutions are mission-critical for defense IT modernization. Stock is up 5.7% and trending well. Adding 1500 shares brings total to 7130 shares (~13.5% weight). This is our highest conviction mid-cap pure-play on defense software infrastructure."", ""regime"": ""SIDEWAYS"", ""top_factors"": []}"
518b5af2,2026-03-25T11:57:57,PLTR,BUY,448,155.31,69581.12,118.41,225.78,SIGNAL,SIDEWAYS,0.0,{},,"{""ai_decision"": ""APPROVE"", ""ai_confidence"": 0.9, ""ai_reasoning"": ""Palantir is the quintessential defense AI/software stack company. 70% revenue growth, 82% gross margins, and 26% ROE demonstrate operating leverage in exactly the sensor fusion / data integration layer our thesis targets. PLTR's Gotham and Maven platforms are deeply embedded across DoD, NATO allies, and intelligence agencies. The P/E is elevated but justified by the durability and stickiness of classified contracts. Quant score of 60 reflects sideways momentum which per our deployment posture is"", ""quant_reason"": ""Palantir is the quintessential defense AI/software stack company. 70% revenue growth, 82% gross margins, and 26% ROE demonstrate operating leverage in exactly the sensor fusion / data integration layer our thesis targets. PLTR's Gotham and Maven platforms are deeply embedded across DoD, NATO allies, and intelligence agencies. The P/E is elevated but justified by the durability and stickiness of classified contracts. Quant score of 60 reflects sideways momentum which per our deployment posture is a better entry point for a structural winner. Position sized at ~6.7% of equity \u2014 meaningful but not overweight given existing tech exposure."", ""regime"": ""SIDEWAYS"", ""top_factors"": []}"
99a08c24,2026-03-25T11:57:57,SAIC,BUY,441,95.0,41895.0,76.68,127.79,SIGNAL,SIDEWAYS,0.0,{},,"{""ai_decision"": ""APPROVE"", ""ai_confidence"": 0.9, ""ai_reasoning"": ""Adding to existing SAIC position. SAIC is a core defense IT and systems integration contractor with long-duration government contracts across C4ISR, electronic warfare simulation, and autonomous systems support. Currently only 7.8% weight with a modest +0.4% P&L \u2014 averaging into the position at roughly the same cost basis strengthens our exposure to the defense software/services layer. Combined position will be ~11.8% of equity, well within limits. Stop and target unchanged from existing positio"", ""quant_reason"": ""Adding to existing SAIC position. SAIC is a core defense IT and systems integration contractor with long-duration government contracts across C4ISR, electronic warfare simulation, and autonomous systems support. Currently only 7.8% weight with a modest +0.4% P&L \u2014 averaging into the position at roughly the same cost basis strengthens our exposure to the defense software/services layer. Combined position will be ~11.8% of equity, well within limits. Stop and target unchanged from existing position parameters."", ""regime"": ""SIDEWAYS"", ""top_factors"": []}"
ad792164,2026-03-25T11:57:57,LHX,BUY,116,354.4,41110.4,295.51,440.76,SIGNAL,SIDEWAYS,0.0,{},,"{""ai_decision"": ""APPROVE"", ""ai_confidence"": 0.9, ""ai_reasoning"": ""Adding to L3Harris position. LHX is a premier sensor fusion, electronic warfare, and space-based ISR company \u2014 directly in our thesis sweet spot. They are the backbone of next-gen comms, EW pods, and satellite payloads for NATO modernization programs. Current weight is 9.6% with +0.7% P&L. Adding shares brings us to ~13.5% which reflects high conviction in a name with predictable multi-year contract revenue. Weak momentum is exactly the entry opportunity our mandate describes."", ""quant_reason"": ""Adding to L3Harris position. LHX is a premier sensor fusion, electronic warfare, and space-based ISR company \u2014 directly in our thesis sweet spot. They are the backbone of next-gen comms, EW pods, and satellite payloads for NATO modernization programs. Current weight is 9.6% with +0.7% P&L. Adding shares brings us to ~13.5% which reflects high conviction in a name with predictable multi-year contract revenue. Weak momentum is exactly the entry opportunity our mandate describes."", ""regime"": ""SIDEWAYS"", ""top_factors"": []}"
4494057c,2026-03-25T11:57:57,ESE,BUY,146,288.51,42122.46,233.7,379.24,SIGNAL,SIDEWAYS,0.0,{},,"{""ai_decision"": ""APPROVE"", ""ai_confidence"": 0.9, ""ai_reasoning"": ""Adding to ESCO Technologies position. ESE makes test & measurement equipment, RF shielding, and utility solutions with meaningful defense/aerospace exposure through its Aerospace & Defense segment (radar filters, electronic countermeasures). Currently 8.4% weight with +1.0% P&L. Adding shares brings weight to ~12.4% \u2014 the business has stable margins and long-cycle defense contracts. Entry near current levels with an intact thesis warrants building the position."", ""quant_reason"": ""Adding to ESCO Technologies position. ESE makes test & measurement equipment, RF shielding, and utility solutions with meaningful defense/aerospace exposure through its Aerospace & Defense segment (radar filters, electronic countermeasures). Currently 8.4% weight with +1.0% P&L. Adding shares brings weight to ~12.4% \u2014 the business has stable margins and long-cycle defense contracts. Entry near current levels with an intact thesis warrants building the position."", ""regime"": ""SIDEWAYS"", ""top_factors"": []}"
9e6677a4,2026-03-25T11:57:57,VICR,BUY,99,188.69,18680.2,151.08,271.95,SIGNAL,SIDEWAYS,0.0,{},,"{""ai_decision"": ""APPROVE"", ""ai_confidence"": 0.9, ""ai_reasoning"": ""Adding to Vicor position. Vicor's high-density power modules are critical enabling technology for autonomous drones, radar systems, electronic warfare pods, and directed energy weapons \u2014 all areas seeing compressed investment timelines. Currently only 4.7% weight with a -0.8% unrealized loss. This is the definition of a dip-buy opportunity in a pure-play components supplier to defense autonomy. Adding 100 shares brings weight to ~6.5%, still conservative for a high-conviction name."", ""quant_reason"": ""Adding to Vicor position. Vicor's high-density power modules are critical enabling technology for autonomous drones, radar systems, electronic warfare pods, and directed energy weapons \u2014 all areas seeing compressed investment timelines. Currently only 4.7% weight with a -0.8% unrealized loss. This is the definition of a dip-buy opportunity in a pure-play components supplier to defense autonomy. Adding 100 shares brings weight to ~6.5%, still conservative for a high-conviction name."", ""regime"": ""SIDEWAYS"", ""top_factors"": []}"
fe4467f8,2026-03-25T14:55:11,GD,BUY,200,353.69,70738.0,298.0,440.0,SIGNAL,SIDEWAYS,0.0,{},,"{""ai_decision"": ""APPROVE"", ""ai_confidence"": 0.9, ""ai_reasoning"": ""General Dynamics is a top-tier defense prime with Gulfstream, combat systems, and mission systems divisions. The GDIT unit is building exactly the kind of C4ISR and software integration layers our thesis targets. At P/E 22.9 with 7.8% revenue growth and 17.7% ROE, it's reasonably valued for a defense name with long-duration contract backlog. Value_timing score of 94 suggests attractive entry. Strong fit with our defense tech mandate \u2014 complements LHX exposure with different program mix (submarin"", ""quant_reason"": ""AI allocation"", ""regime"": ""SIDEWAYS"", ""top_factors"": []}"
79d55b19,2026-03-25T14:55:11,MOG-A,BUY,175,305.65,53488.75,248.0,400.0,SIGNAL,SIDEWAYS,0.0,{},,"{""ai_decision"": ""APPROVE"", ""ai_confidence"": 0.9, ""ai_reasoning"": ""Moog Inc. is a pure-play defense/aerospace components maker \u2014 precision motion control, actuation systems, and avionics for fighter jets, missiles, satellites, and drones. 21.2% revenue growth is outstanding for this niche. Volume score of 100 signals institutional accumulation. This is exactly the kind of mid-cap supplier building critical subsystems for next-gen platforms (F-35, hypersonics, space). The structural spending tailwind directly benefits Moog's backlog. Momentum is weak (47) which "", ""quant_reason"": ""AI allocation"", ""regime"": ""SIDEWAYS"", ""top_factors"": []}"
74d0f944,2026-03-25T14:55:11,KEX,BUY,200,135.7,27140.0,112.0,172.0,SIGNAL,SIDEWAYS,0.0,{},,"{""ai_decision"": ""APPROVE"", ""ai_confidence"": 0.9, ""ai_reasoning"": ""Kirby Corporation operates inland tank barges but also has a meaningful distribution and services segment supporting defense and industrial markets. At 20.6% revenue growth and decent margins, it's a logistics backbone play. However, the primary reason is portfolio diversification within industrials that touch defense supply chains. Decent momentum at 77, reasonable valuation. This is a secondary conviction position to deploy remaining cash productively rather than sit idle."", ""quant_reason"": ""AI allocation"", ""regime"": ""SIDEWAYS"", ""top_factors"": []}"
597d3cc2,2026-03-26T13:46:17,VICR,SELL,357,161.62,57700.12,,,STOP_LOSS,,,,,"{""ai_decision"": ""APPROVE"", ""ai_confidence"": 1.0, ""ai_reasoning"": ""Layer 1 mechanical sell \u2014 stop/target/quality trigger"", ""quant_reason"": ""STOP LOSS (regime) triggered: $161.62 <= $178.26"", ""regime"": ""BEAR"", ""top_factors"": []}"
ec027b40,2026-03-26T13:46:17,AIR,SELL,400,111.78,44712.0,,,STOP_LOSS,,,,,"{""ai_decision"": ""APPROVE"", ""ai_confidence"": 1.0, ""ai_reasoning"": ""Layer 1 mechanical sell \u2014 stop/target/quality trigger"", ""quant_reason"": ""STOP LOSS (trailing) triggered: $111.97 <= $115.41"", ""regime"": ""BEAR"", ""top_factors"": []}"
8f2afaa0,2026-03-26T13:46:17,BWXT,BUY,200,208.59,41718.0,174.7,289.5,SIGNAL,BEAR,0.0,{},,"{""ai_decision"": ""APPROVE"", ""ai_confidence"": 0.9, ""ai_reasoning"": ""BWX Technologies is a core defense-tech name \u2014 nuclear propulsion for Navy submarines and carriers, advanced nuclear technologies, and critical defense infrastructure. Revenue growth +18.7%, ROE 28.5%, and long-duration government contracts provide exactly the predictable revenue stream our thesis targets. P/E is elevated at 58x but reflects the premium for irreplaceable nuclear capabilities. Quant score 62 with solid momentum (74) and value_timing (89). This is a structural beneficiary of Navy "", ""quant_reason"": ""AI allocation"", ""regime"": ""BEAR"", ""top_factors"": []}"
f5686f8a,2026-03-26T13:46:17,LMT,BUY,100,629.31,62931.0,540.0,780.0,SIGNAL,BEAR,0.0,{},,"{""ai_decision"": ""APPROVE"", ""ai_confidence"": 0.9, ""ai_reasoning"": ""Lockheed Martin is the anchor prime contractor in our defense thesis. F-35 production ramp, hypersonics programs, space-based ISR through Space division, and massive international order book as NATO allies increase spending. Revenue growth +9.1%, extraordinary ROE of 76.9%, and a P/E of 29.3 that's reasonable for defense primes given contract visibility. Momentum score of 57 in a bear market is exactly the kind of 'weak momentum = better entry' our mandate calls for. Adding ~$63K (~6% weight) to"", ""quant_reason"": ""AI allocation"", ""regime"": ""BEAR"", ""top_factors"": []}"
b4a3e374,2026-03-26T13:46:17,ENS,BUY,199,171.69,34165.32,145.19,225.3,SIGNAL,BEAR,0.0,{},,"{""ai_decision"": ""APPROVE"", ""ai_confidence"": 0.9, ""ai_reasoning"": ""EnerSys provides mission-critical power solutions for defense platforms \u2014 batteries and power systems for military vehicles, submarines, aircraft, and communications systems. The electrification of military platforms is a secular tailwind. Revenue growth modest at +1.4% but gross margin 29.8%, ROE 16.7%, and the quant profile shows decent momentum (74) with strong value_timing (86). At ~$34K (~3.3% weight), this adds a differentiated power/energy storage angle to our defense portfolio that compl"", ""quant_reason"": ""AI allocation"", ""regime"": ""BEAR"", ""top_factors"": []}"
6d856d80,2026-03-26T13:46:17,MSM,BUY,250,90.86,22715.0,76.0,120.0,SIGNAL,BEAR,0.0,{},,"{""ai_decision"": ""APPROVE"", ""ai_confidence"": 0.9, ""ai_reasoning"": ""MSC Industrial Direct supplies precision tooling, metalworking, and industrial components to defense manufacturers and contractors. They're a picks-and-shovels play on defense production ramp \u2014 as contract volumes increase across primes and mid-caps, MSM's distribution network benefits. Gross margin 40.7%, ROE 14.7%, P/E 24.8. Quant momentum is weak at 54 but value_timing is excellent at 94 \u2014 classic dip-buy opportunity per our mandate. ~$23K position (~2.2% weight) keeps it as a supporting posi"", ""quant_reason"": ""AI allocation"", ""regime"": ""BEAR"", ""top_factors"": []}"
d6cae7db,2026-03-26T13:46:17,SAIC,BUY,250,99.28,24820.0,76.68,127.79,SIGNAL,BEAR,0.0,{},,"{""ai_decision"": ""APPROVE"", ""ai_confidence"": 0.9, ""ai_reasoning"": ""Adding to existing SAIC position. This is a core holding \u2014 IT services, AI/ML integration, and digital transformation for DoD and intelligence community. Already up 4.9% and held only 1 day. The software stack and sensor fusion layer thesis is exactly what SAIC delivers. Revenue growth +4.9% is understated given contract pipeline. Adding 250 shares (~$25K) brings total weight to ~15%, reflecting high conviction in this name as a primary beneficiary of defense digitization spending."", ""quant_reason"": ""AI allocation"", ""regime"": ""BEAR"", ""top_factors"": []}"
ee52f99f,2026-03-26T21:16:19,KEX,SELL,200,139.29,27858.0,,,INTELLIGENCE,,,,,"{""ai_decision"": ""APPROVE"", ""ai_confidence"": 0.9, ""ai_reasoning"": ""Kirby Corporation is a marine transportation/inland barge company. While classified as Industrials, it has zero alignment with defense tech, autonomous systems, sensor fusion, or military hardware. It's an energy logistics play. At only 2.7% weight and modest P&L (+1.3%), selling frees capital for thesis-aligned names and improves portfolio coherence. This capital can be redeployed into defense/cyber positions on the next opportunity."", ""quant_reason"": ""AI allocation"", ""regime"": ""SIDEWAYS"", ""top_factors"": []}"
34f32016,2026-03-26T21:16:19,MSM,SELL,250,88.14,22035.0,,,INTELLIGENCE,,,,,"{""ai_decision"": ""APPROVE"", ""ai_confidence"": 0.9, ""ai_reasoning"": ""MSC Industrial Direct is an industrial distribution company selling cutting tools and maintenance supplies. While it tangentially serves manufacturing including defense contractors, it's a broad industrial distributor with no meaningful defense tech or autonomous systems exposure. At 2.2% weight with -1.5% P&L, it's a small drag with no strategic fit. Freeing this capital improves thesis alignment."", ""quant_reason"": ""AI allocation"", ""regime"": ""SIDEWAYS"", ""top_factors"": []}"
2220c8c7,2026-03-30T09:47:02,LHX,SELL,400,345.3,138120.0,,,INTELLIGENCE,,,,,"{""ai_decision"": ""APPROVE"", ""ai_confidence"": 1.0, ""ai_reasoning"": ""MOMENTUM FADE: 3 consecutive closes below 5-day SMA \u2014 trend reversing"", ""quant_reason"": ""MOMENTUM FADE: 3 consecutive closes below 5-day SMA \u2014 trend reversing"", ""regime"": ""SIDEWAYS"", ""top_factors"": []}"
1bfc6fdf,2026-03-30T09:47:02,PLTR,SELL,448,142.54,63857.96,,,STOP_LOSS,,,,,"{""ai_decision"": ""APPROVE"", ""ai_confidence"": 1.0, ""ai_reasoning"": ""STOP LOSS (regime) triggered: $142.85 <= $144.44"", ""quant_reason"": ""STOP LOSS (regime) triggered: $142.85 <= $144.44"", ""regime"": ""SIDEWAYS"", ""top_factors"": []}"
f4327f03,2026-03-30T09:47:02,BWXT,SELL,200,197.53,39506.0,,,INTELLIGENCE,,,,,"{""ai_decision"": ""APPROVE"", ""ai_confidence"": 1.0, ""ai_reasoning"": ""MOMENTUM FADE: 3 consecutive closes below 5-day SMA \u2014 trend reversing"", ""quant_reason"": ""MOMENTUM FADE: 3 consecutive closes below 5-day SMA \u2014 trend reversing"", ""regime"": ""SIDEWAYS"", ""top_factors"": []}"
188d4af0,2026-03-30T09:47:02,ENS,SELL,199,170.43,33915.57,,,INTELLIGENCE,,,,,"{""ai_decision"": ""APPROVE"", ""ai_confidence"": 1.0, ""ai_reasoning"": ""MOMENTUM FADE: 3 consecutive closes below 5-day SMA \u2014 trend reversing"", ""quant_reason"": ""MOMENTUM FADE: 3 consecutive closes below 5-day SMA \u2014 trend reversing"", ""regime"": ""SIDEWAYS"", ""top_factors"": []}"
4de07927,2026-03-30T20:45:22,ESE,SELL,450,263.81,118714.5,,,STOP_LOSS,,,,,"{""ai_decision"": ""APPROVE"", ""ai_confidence"": 1.0, ""ai_reasoning"": ""STOP LOSS (regime) triggered: $263.81 <= $266.58"", ""quant_reason"": ""STOP LOSS (regime) triggered: $263.81 <= $266.58"", ""regime"": ""SIDEWAYS"", ""top_factors"": []}"
c71e5d84,2026-03-30T20:45:22,MOG-A,SELL,175,283.82,49668.5,,,STOP_LOSS,,,,,"{""ai_decision"": ""APPROVE"", ""ai_confidence"": 1.0, ""ai_reasoning"": ""STOP LOSS (regime) triggered: $283.82 <= $284.25"", ""quant_reason"": ""STOP LOSS (regime) triggered: $283.82 <= $284.25"", ""regime"": ""SIDEWAYS"", ""top_factors"": []}"
