transaction_id,date,ticker,action,shares,price,total_value,stop_loss,take_profit,reason,regime_at_entry,composite_score,factor_scores,signal_rank,trade_rationale
82b762dc,2026-04-06T18:28:54,ECPG,BUY,900,72.53,65277.0,59.5,115.0,SIGNAL,SIDEWAYS,0,"{""price_momentum"": 75.3, ""earnings_growth"": 50.0, ""quality"": 50.0, ""value_timing"": 75.0, ""volume"": 40.5, ""volatility"": 58.3}",,"{""ai_decision"": ""APPROVE"", ""ai_confidence"": 0.9, ""ai_reasoning"": ""Encore Capital is a debt purchaser with 78% rev growth, 100% gross margin (asset-light collections model), P/E of 6.6, and ROE of 29.5%. This is exactly the kind of unloved, cash-generating business in a space institutions avoid due to reputational concerns. Deep value with strong momentum (75). High D/E is structural for this business model \u2014 they lever up to buy debt portfolios at pennies on the dollar. 3-5x asymmetry exists if earnings normalize at these multiples."", ""quant_reason"": ""AI allocation"", ""regime"": ""SIDEWAYS"", ""top_factors"": [{""name"": ""price_momentum"", ""score"": 75.3}, {""name"": ""value_timing"", ""score"": 75.0}, {""name"": ""volatility"", ""score"": 58.3}]}"
91d3c06b,2026-04-06T18:28:54,JILL,BUY,2199,11.24,24716.76,8.98,18.91,SIGNAL,SIDEWAYS,0,"{""price_momentum"": 57.0, ""earnings_growth"": 50.0, ""quality"": 50.0, ""value_timing"": 92.7, ""volume"": 50.1, ""volatility"": 67.9}",,"{""ai_decision"": ""APPROVE"", ""ai_confidence"": 0.9, ""ai_reasoning"": ""J.Jill trades at 6.3x earnings with 24.5% ROE and 68.7% gross margins \u2014 classic unloved micro-cap retailer. Value_timing score of 93 is the highest on the list. Revenue decline of -3.1% is modest and likely priced in at this multiple. High D/E reflects lease obligations typical of retail. Insider-type deep value play where the market is pricing in permanent decline but the cash generation says otherwise."", ""quant_reason"": ""AI allocation"", ""regime"": ""SIDEWAYS"", ""top_factors"": [{""name"": ""value_timing"", ""score"": 92.7}, {""name"": ""volatility"", ""score"": 67.9}, {""name"": ""price_momentum"", ""score"": 57.0}]}"
1e0f8646,2026-04-06T18:28:54,UFCS,BUY,1400,37.61,52654.0,31.5,55.0,SIGNAL,SIDEWAYS,0,"{""price_momentum"": 59.1, ""earnings_growth"": 50.0, ""quality"": 50.0, ""value_timing"": 91.0, ""volume"": 43.0, ""volatility"": 65.4}",,"{""ai_decision"": ""APPROVE"", ""ai_confidence"": 0.9, ""ai_reasoning"": ""United Fire Group \u2014 small P&C insurer at 8.4x P/E, 13.7% ROE, growing revenue at 9.8%. Value_timing of 91, solid quality metrics. Insurance micro-caps sit squarely in the research desert \u2014 no analyst coverage, below institutional minimums. Hard market pricing still flowing through. Low D/E for a financial. Patient capital play."", ""quant_reason"": ""AI allocation"", ""regime"": ""SIDEWAYS"", ""top_factors"": [{""name"": ""value_timing"", ""score"": 91.0}, {""name"": ""volatility"", ""score"": 65.4}, {""name"": ""price_momentum"", ""score"": 59.1}]}"
c718fd06,2026-04-06T18:28:54,DLNG,BUY,6983,4.27,29817.41,3.31,7.52,SIGNAL,SIDEWAYS,0,"{""price_momentum"": 58.2, ""earnings_growth"": 50.0, ""quality"": 50.0, ""value_timing"": 87.9, ""volume"": 40.9, ""volatility"": 47.7}",,"{""ai_decision"": ""APPROVE"", ""ai_confidence"": 0.9, ""ai_reasoning"": ""Dynagas LNG Partners \u2014 energy infrastructure with long-term LNG shipping contracts (10-15 year charter profile). P/E of 3.1, ROE of 12.9%, 74% gross margins. ESG crowd has completely abandoned LNG shipping. Value_timing of 88. This is the exact mandate archetype: contracted energy infrastructure abandoned by ESG, generating real cash, trading at throwaway multiples. Illiquid and unloved."", ""quant_reason"": ""AI allocation"", ""regime"": ""SIDEWAYS"", ""top_factors"": [{""name"": ""value_timing"", ""score"": 87.9}, {""name"": ""price_momentum"", ""score"": 58.2}, {""name"": ""earnings_growth"", ""score"": 50.0}]}"
62e555e0,2026-04-06T18:28:54,LPG,BUY,1200,34.5,41400.0,28.0,52.0,SIGNAL,SIDEWAYS,0,"{""price_momentum"": 67.5, ""earnings_growth"": 50.0, ""quality"": 50.0, ""value_timing"": 83.8, ""volume"": 32.5, ""volatility"": 43.0}",,"{""ai_decision"": ""APPROVE"", ""ai_confidence"": 0.9, ""ai_reasoning"": ""Dorian LPG \u2014 another energy shipping play with 47% rev growth, 63% gross margins, P/E of 12.2, and 11.2% ROE. Long-term VLGC contracts in LPG transport. ESG-abandoned sector with real cash flows and decent momentum (68). Value_timing of 84 confirms attractive entry. Complements DLNG as a contracted energy infrastructure pair."", ""quant_reason"": ""AI allocation"", ""regime"": ""SIDEWAYS"", ""top_factors"": [{""name"": ""value_timing"", ""score"": 83.8}, {""name"": ""price_momentum"", ""score"": 67.5}, {""name"": ""earnings_growth"", ""score"": 50.0}]}"
57ad0dbf,2026-04-06T18:28:54,DCOM,BUY,884,34.41,30418.44,28.04,50.66,SIGNAL,SIDEWAYS,0,"{""price_momentum"": 57.0, ""earnings_growth"": 50.0, ""quality"": 50.0, ""value_timing"": 92.7, ""volume"": 50.1, ""volatility"": 67.9}",,"{""ai_decision"": ""APPROVE"", ""ai_confidence"": 0.9, ""ai_reasoning"": ""Dime Financial \u2014 community bank post-merger with 159% revenue growth (acquisition-driven but now integrated), P/E of 14.6, ROE of 7.7%. Value_timing of 93 \u2014 deeply undervalued versus peers. Community banks are the ultimate research desert. Below institutional minimums, no analyst coverage, but generating real earnings with improving efficiency ratios post-merger."", ""quant_reason"": ""AI allocation"", ""regime"": ""SIDEWAYS"", ""top_factors"": [{""name"": ""value_timing"", ""score"": 92.7}, {""name"": ""volatility"", ""score"": 67.9}, {""name"": ""price_momentum"", ""score"": 57.0}]}"
04754627,2026-04-06T18:28:54,VPG,BUY,441,46.12,20338.92,36.98,76.14,SIGNAL,SIDEWAYS,0,"{""price_momentum"": 73.8, ""earnings_growth"": 50.0, ""quality"": 50.0, ""value_timing"": 81.8, ""volume"": 51.1, ""volatility"": 55.8}",,"{""ai_decision"": ""APPROVE"", ""ai_confidence"": 0.9, ""ai_reasoning"": ""Vishay Precision Group \u2014 niche sensor/semiconductor company with 38.9% gross margins and 10.9% revenue growth. Value_timing of 82. This is the semiconductor mandate archetype \u2014 real technology with real margins in a niche that larger fabs ignore. Low D/E of 13.2 means no balance sheet risk. P/E elevated but driven by cyclical trough earnings. Patient capital play for 3x upside as sensor demand recovers."", ""quant_reason"": ""AI allocation"", ""regime"": ""SIDEWAYS"", ""top_factors"": [{""name"": ""value_timing"", ""score"": 81.8}, {""name"": ""price_momentum"", ""score"": 73.8}, {""name"": ""volatility"", ""score"": 55.8}]}"
fef05335,2026-04-06T18:28:54,HRMY,BUY,1223,28.12,34390.76,22.47,42.49,SIGNAL,SIDEWAYS,0,"{""price_momentum"": 76.2, ""earnings_growth"": 50.0, ""quality"": 50.0, ""value_timing"": 65.4, ""volume"": 43.3, ""volatility"": 61.2}",,"{""ai_decision"": ""APPROVE"", ""ai_confidence"": 0.9, ""ai_reasoning"": ""Harmony Biosciences \u2014 commercial-stage specialty pharma with 21% rev growth, 77% gross margins, P/E of 10.2, and 20.8% ROE. Profitable biotech is rare in micro/small-cap land. Narcolepsy franchise generates real cash. This is the post-commercialization biotech play our mandate targets \u2014 past the clinical risk, generating profits, but still in the research desert where sentiment hasn't caught up to fundamentals."", ""quant_reason"": ""AI allocation"", ""regime"": ""SIDEWAYS"", ""top_factors"": [{""name"": ""price_momentum"", ""score"": 76.2}, {""name"": ""value_timing"", ""score"": 65.4}, {""name"": ""volatility"", ""score"": 61.2}]}"
